Outline Level,ID,Name,Start,Finish,Duration,% Complete,Predecessors,Resource Names,Color,Notes
1,1,"Information: Anforderungsermittlung und Technologierecherche",2024-06-17,2024-06-17,0.03750503472222222 day,0,"","Team Member 1",,""
1,2,"Planung: Erstellen eines Gantt-Diagramms und Mockups der App",2024-06-17,2024-06-17,0.0604015625 day,0,"","Team Member 2",,""
1,3,"Entscheidung: Auswahl der zu implementierenden Funktionen und Technologien",2024-06-17,2024-06-17,0.03334538194444445 day,0,"","Team Member 1",,""
1,4,"Realisierung: Implementierung der Item-Klasse und der Basisstruktur",2024-06-17,2024-06-17,0.03750149305555555 day,0,"","Team Member 1",,""
1,5,"Realisierung: Entwicklung der ViewModels und Services",2024-06-17,2024-06-17,0.18751357638888888 day,0,"","Team Member 2",,""
1,6,"Realisierung: Erstellung der Benutzeroberfläche",2024-06-17,2024-06-17,0.0750226388888889 day,0,"","Team Member 1",,""
1,7,"Realisierung: Implementierung der optionalen Anforderungen",2024-06-17,2024-06-17,0.006244201388888892 day,0,"","Team Member 2",,"<p><br></p>"
1,8,"Kontrolle: Testing und Debugging der App",2024-06-17,2024-06-17,0.043752986111111114 day,0,"","Team Member 1",,""
1,9,"Auswertung: Dokumentation und Vorbereitung der Präsentation",2024-06-17,2024-06-17,0.1228985763888889 day,0,"","Team Member 2",,""